{
  "type": "vendor_api_zktls",
  "evidence_hash": "0xe7e7e7e7e7e7e7e7e7e7e7e7e7e7e7e7e7e7e7e7e7e7e7e7e7e7e7e7e7e7e7e7",
  "signer_set": [
    "oracle-operator-01",
    "oracle-operator-02"
  ],
  "created_at": "2026-07-15T10:05:00Z",
  "observed_at": "2026-07-15T10:04:50Z",
  "predicate_result": true
}
